{
  "schema": "calllint.evidence-manifest.v1",
  "subject": {
    "canonicalName": "mcp-registry/ai.fenbs-fenbs",
    "artifactDigest": "sha256:61d8d43e48bbadfedec25d0bde6d408190a7a9876bf13444fea52f82c94d89af"
  },
  "verdict": "REVIEW",
  "verdictLabel": "Review required",
  "completeness": "complete",
  "evidenceLevel": "E2",
  "evidenceRationale": "install config observed → static blast radius normalized into an authority inventory. Higher levels (E3 tool schema, E4 maintainer receipt, E5 sandbox) are not carried by a static page.",
  "status": {
    "verdict": "REVIEW",
    "completeness": "complete",
    "authorityClaimed": false,
    "reproducibility": {
      "pageDigest": "sha256:864a169fee0c8b9e449e41f9f1115f0ba16853941c7e77b0a2ac1b0d819282e2",
      "observedAt": "2026-10-01T13:14:15.000Z"
    },
    "evidenceLevel": "E2"
  },
  "authority": {
    "digest": "sha256:32822b5e938880d08e751581d19923377b4eaa86969feb4c2c04ee1f346bfd2c",
    "completeness": "complete",
    "capabilityCount": 2,
    "approvalRequired": [
      "external-network-access"
    ],
    "capabilities": [
      {
        "action": "execute",
        "resource": "process",
        "mutability": "mutating",
        "reversibility": "irreversible",
        "approvalRequirement": "none"
      },
      {
        "action": "connect",
        "resource": "network",
        "mutability": "mutating",
        "reversibility": "irreversible",
        "approvalRequirement": "review"
      }
    ]
  },
  "policyDigest": null,
  "reproducibility": {
    "pageDigest": "sha256:864a169fee0c8b9e449e41f9f1115f0ba16853941c7e77b0a2ac1b0d819282e2",
    "observedAt": "2026-10-01T13:14:15.000Z"
  },
  "engine": {
    "name": "calllint"
  },
  "correctionUrl": "https://github.com/calllint/calllint/issues/new?labels=trust-page-correction",
  "generatedAt": "2026-10-01T13:14:15.000Z",
  "signature": null
}
