{
  "schema": "calllint.evidence-manifest.v1",
  "subject": {
    "canonicalName": "mcp-registry/ai.agentgates-mcp",
    "artifactDigest": "sha256:a4bcb274a60879c355511418f638dbcc740751613dd64c212d0d24d3b6da0810"
  },
  "verdict": "REVIEW",
  "verdictLabel": "Review required",
  "completeness": "complete",
  "evidenceLevel": "E2",
  "evidenceRationale": "install config observed → static blast radius normalized into an authority inventory. Higher levels (E3 tool schema, E4 maintainer receipt, E5 sandbox) are not carried by a static page.",
  "status": {
    "verdict": "REVIEW",
    "completeness": "complete",
    "authorityClaimed": false,
    "reproducibility": {
      "pageDigest": "sha256:8900179f086d21162eca1f38d7759dbbf81f19577c45c3c20ac304f892bde698",
      "observedAt": "2026-10-19T13:04:27.000Z"
    },
    "evidenceLevel": "E2"
  },
  "authority": {
    "digest": "sha256:f8088fe8f234a1f26fd7e3c3c313bef37611733f8b6dc319e41b7380cad4153e",
    "completeness": "complete",
    "capabilityCount": 1,
    "approvalRequired": [
      "external-network-access"
    ],
    "capabilities": [
      {
        "action": "connect",
        "resource": "network",
        "mutability": "mutating",
        "reversibility": "irreversible",
        "approvalRequirement": "review"
      }
    ]
  },
  "policyDigest": null,
  "reproducibility": {
    "pageDigest": "sha256:8900179f086d21162eca1f38d7759dbbf81f19577c45c3c20ac304f892bde698",
    "observedAt": "2026-10-19T13:04:27.000Z"
  },
  "engine": {
    "name": "calllint"
  },
  "correctionUrl": "https://github.com/calllint/calllint/issues/new?labels=trust-page-correction",
  "generatedAt": "2026-10-19T13:04:27.000Z",
  "signature": null
}
