{
  "schema": "calllint.evidence-manifest.v1",
  "subject": {
    "canonicalName": "mcp-registry/ai.baselight-baselight",
    "artifactDigest": "sha256:10061a6ddccd086ee110583d99888e31e08fead42eecacfdad958d092c69af6a"
  },
  "verdict": "UNKNOWN",
  "verdictLabel": "Insufficient evidence",
  "completeness": "complete",
  "evidenceLevel": "E2",
  "evidenceRationale": "install config observed → static blast radius normalized into an authority inventory. Higher levels (E3 tool schema, E4 maintainer receipt, E5 sandbox) are not carried by a static page.",
  "status": {
    "verdict": "UNKNOWN",
    "completeness": "complete",
    "authorityClaimed": false,
    "reproducibility": {
      "pageDigest": "sha256:57f07b7caeaa48f47ecf2ee7ab2479acec301fc7a2adc8686558666df1ce61f4",
      "observedAt": "2026-10-19T13:04:27.000Z"
    },
    "evidenceLevel": "E2"
  },
  "authority": {
    "digest": "sha256:c8593a845535879ec49252308825c659cab9812d3ff1917150f8bb8100606675",
    "completeness": "complete",
    "capabilityCount": 1,
    "approvalRequired": [
      "external-network-access"
    ],
    "capabilities": [
      {
        "action": "connect",
        "resource": "network",
        "mutability": "mutating",
        "reversibility": "irreversible",
        "approvalRequirement": "review"
      }
    ]
  },
  "policyDigest": null,
  "reproducibility": {
    "pageDigest": "sha256:57f07b7caeaa48f47ecf2ee7ab2479acec301fc7a2adc8686558666df1ce61f4",
    "observedAt": "2026-10-19T13:04:27.000Z"
  },
  "engine": {
    "name": "calllint"
  },
  "correctionUrl": "https://github.com/calllint/calllint/issues/new?labels=trust-page-correction",
  "generatedAt": "2026-10-19T13:04:27.000Z",
  "signature": null
}
