{
  "schema": "calllint.evidence-manifest.v1",
  "subject": {
    "canonicalName": "mcp-registry/ai.dynamicfeed-dynamic-feed",
    "artifactDigest": "sha256:d8d37233258d0bb9287f1050f594d183720c6968e5d7d4b376e61b77a1e38b9d"
  },
  "verdict": "REVIEW",
  "verdictLabel": "Review required",
  "completeness": "complete",
  "evidenceLevel": "E2",
  "evidenceRationale": "install config observed → static blast radius normalized into an authority inventory. Higher levels (E3 tool schema, E4 maintainer receipt, E5 sandbox) are not carried by a static page.",
  "status": {
    "verdict": "REVIEW",
    "completeness": "complete",
    "authorityClaimed": false,
    "reproducibility": {
      "pageDigest": "sha256:bcf9969822892a26c42943192acd4f24c10767734f9df6aa49f83d859d2149cf",
      "observedAt": "2026-10-19T13:04:27.000Z"
    },
    "evidenceLevel": "E2"
  },
  "authority": {
    "digest": "sha256:6d24ef72a84234e1c44e4ab9dcfddf50ee285507321366dc0be2fdbc8101a445",
    "completeness": "complete",
    "capabilityCount": 2,
    "approvalRequired": [
      "external-network-access"
    ],
    "capabilities": [
      {
        "action": "connect",
        "resource": "network",
        "mutability": "mutating",
        "reversibility": "irreversible",
        "approvalRequirement": "review"
      },
      {
        "action": "connect",
        "resource": "network",
        "mutability": "mutating",
        "reversibility": "irreversible",
        "approvalRequirement": "review"
      }
    ]
  },
  "policyDigest": null,
  "reproducibility": {
    "pageDigest": "sha256:bcf9969822892a26c42943192acd4f24c10767734f9df6aa49f83d859d2149cf",
    "observedAt": "2026-10-19T13:04:27.000Z"
  },
  "engine": {
    "name": "calllint"
  },
  "correctionUrl": "https://github.com/calllint/calllint/issues/new?labels=trust-page-correction",
  "generatedAt": "2026-10-19T13:04:27.000Z",
  "signature": null
}
