{
  "schema": "calllint.evidence-manifest.v1",
  "subject": {
    "canonicalName": "mcp-registry/ai.bowmark-bowmark",
    "artifactDigest": "sha256:b3e0d0aef65f70fd020a05e9e16a5973fe8d46477611c95bbfaff39deb096e90"
  },
  "verdict": "UNKNOWN",
  "verdictLabel": "Insufficient evidence",
  "completeness": "complete",
  "evidenceLevel": "E2",
  "evidenceRationale": "install config observed → static blast radius normalized into an authority inventory. Higher levels (E3 tool schema, E4 maintainer receipt, E5 sandbox) are not carried by a static page.",
  "status": {
    "verdict": "UNKNOWN",
    "completeness": "complete",
    "authorityClaimed": false,
    "reproducibility": {
      "pageDigest": "sha256:f7e6f61f5c97bb0e028b5f51c868f10d2321029a44867cca2a10a0cbb6b7738b",
      "observedAt": "2026-10-12T15:15:35.000Z"
    },
    "evidenceLevel": "E2"
  },
  "authority": {
    "digest": "sha256:68f13b9f511d0756653c39125b9f4c8a2e63918cb9f47d7ef5a73ee5b6d4315d",
    "completeness": "complete",
    "capabilityCount": 3,
    "approvalRequired": [
      "external-network-access"
    ],
    "capabilities": [
      {
        "action": "execute",
        "resource": "process",
        "mutability": "mutating",
        "reversibility": "irreversible",
        "approvalRequirement": "none"
      },
      {
        "action": "execute",
        "resource": "process",
        "mutability": "mutating",
        "reversibility": "irreversible",
        "approvalRequirement": "none"
      },
      {
        "action": "connect",
        "resource": "network",
        "mutability": "mutating",
        "reversibility": "irreversible",
        "approvalRequirement": "review"
      }
    ]
  },
  "policyDigest": null,
  "reproducibility": {
    "pageDigest": "sha256:f7e6f61f5c97bb0e028b5f51c868f10d2321029a44867cca2a10a0cbb6b7738b",
    "observedAt": "2026-10-12T15:15:35.000Z"
  },
  "engine": {
    "name": "calllint"
  },
  "correctionUrl": "https://github.com/calllint/calllint/issues/new?labels=trust-page-correction",
  "generatedAt": "2026-10-12T15:15:35.000Z",
  "signature": null
}
