{
  "schema": "calllint.evidence-manifest.v1",
  "subject": {
    "canonicalName": "calllint-fixtures/review-financial",
    "artifactDigest": "sha256:ac53be3acbaa3d1f6b3aab194297576e3fee0229a9f78954c1f300e219989875"
  },
  "verdict": "REVIEW",
  "verdictLabel": "Review required",
  "completeness": "complete",
  "evidenceLevel": "E2",
  "evidenceRationale": "install config observed → static blast radius normalized into an authority inventory. Higher levels (E3 tool schema, E4 maintainer receipt, E5 sandbox) are not carried by a static page.",
  "status": {
    "verdict": "REVIEW",
    "completeness": "complete",
    "authorityClaimed": false,
    "reproducibility": {
      "pageDigest": "sha256:9def1877ffd18d0c40592e5d707d0d21629413dc16be2a8971a50d2c306a379d",
      "observedAt": "1970-01-01T00:00:00.000Z"
    },
    "evidenceLevel": "E2"
  },
  "authority": {
    "digest": "sha256:b8f763fc327e948540729565978270aad82c2c700ffb61fcd2355e7150b6935a",
    "completeness": "complete",
    "capabilityCount": 1,
    "approvalRequired": [],
    "capabilities": [
      {
        "action": "execute",
        "resource": "process",
        "mutability": "mutating",
        "reversibility": "irreversible",
        "approvalRequirement": "none"
      }
    ]
  },
  "policyDigest": null,
  "reproducibility": {
    "pageDigest": "sha256:9def1877ffd18d0c40592e5d707d0d21629413dc16be2a8971a50d2c306a379d",
    "observedAt": "1970-01-01T00:00:00.000Z"
  },
  "engine": {
    "name": "calllint"
  },
  "correctionUrl": "https://github.com/calllint/calllint/issues/new?labels=trust-page-correction",
  "generatedAt": "1970-01-01T00:00:00.000Z",
  "signature": null
}
