{
  "schema": "calllint.evidence-manifest.v1",
  "subject": {
    "canonicalName": "mcp-registry/ai.cueapi-mcp",
    "artifactDigest": "sha256:8fb6f48a61927df2832038543c812cded23004f629b813c94f9e3194ebf5df88"
  },
  "verdict": "SAFE",
  "verdictLabel": "No blockers observed",
  "completeness": "complete",
  "evidenceLevel": "E2",
  "evidenceRationale": "install config observed → static blast radius normalized into an authority inventory. Higher levels (E3 tool schema, E4 maintainer receipt, E5 sandbox) are not carried by a static page.",
  "status": {
    "verdict": "SAFE",
    "completeness": "complete",
    "authorityClaimed": false,
    "reproducibility": {
      "pageDigest": "sha256:846034be5cf091a8c8d4d21ddf0d95f8b5954d86d51a55ca58c1222e27183ea9",
      "observedAt": "2026-10-12T15:15:35.000Z"
    },
    "evidenceLevel": "E2"
  },
  "authority": {
    "digest": "sha256:e4de1cf6eff176afdfaeae147414364689bfc4fbf27888d2544cb7dbbe27144f",
    "completeness": "complete",
    "capabilityCount": 1,
    "approvalRequired": [],
    "capabilities": [
      {
        "action": "execute",
        "resource": "process",
        "mutability": "mutating",
        "reversibility": "irreversible",
        "approvalRequirement": "none"
      }
    ]
  },
  "policyDigest": null,
  "reproducibility": {
    "pageDigest": "sha256:846034be5cf091a8c8d4d21ddf0d95f8b5954d86d51a55ca58c1222e27183ea9",
    "observedAt": "2026-10-12T15:15:35.000Z"
  },
  "engine": {
    "name": "calllint"
  },
  "correctionUrl": "https://github.com/calllint/calllint/issues/new?labels=trust-page-correction",
  "generatedAt": "2026-10-12T15:15:35.000Z",
  "signature": null
}
