{
  "schema": "calllint.evidence-manifest.v1",
  "subject": {
    "canonicalName": "mcp-registry/ae.brainy-grocery-prices",
    "artifactDigest": "sha256:9af7e84856ea765160b6f7e5a03cffcc57b1870abf3cc7a2a65c91f8870567fb"
  },
  "verdict": "REVIEW",
  "verdictLabel": "Review required",
  "completeness": "complete",
  "evidenceLevel": "E2",
  "evidenceRationale": "install config observed → static blast radius normalized into an authority inventory. Higher levels (E3 tool schema, E4 maintainer receipt, E5 sandbox) are not carried by a static page.",
  "status": {
    "verdict": "REVIEW",
    "completeness": "complete",
    "authorityClaimed": false,
    "reproducibility": {
      "pageDigest": "sha256:aa8f2d1f44625009a2b43ccc21e2c78191e1f051880cd9903117e631f4f2cb46",
      "observedAt": "2026-10-12T15:15:35.000Z"
    },
    "evidenceLevel": "E2"
  },
  "authority": {
    "digest": "sha256:69c83c47db42be066983c82b8a1ab1c888bbd71f5e7e55d55091a7609c959355",
    "completeness": "complete",
    "capabilityCount": 1,
    "approvalRequired": [
      "external-network-access"
    ],
    "capabilities": [
      {
        "action": "connect",
        "resource": "network",
        "mutability": "mutating",
        "reversibility": "irreversible",
        "approvalRequirement": "review"
      }
    ]
  },
  "policyDigest": null,
  "reproducibility": {
    "pageDigest": "sha256:aa8f2d1f44625009a2b43ccc21e2c78191e1f051880cd9903117e631f4f2cb46",
    "observedAt": "2026-10-12T15:15:35.000Z"
  },
  "engine": {
    "name": "calllint"
  },
  "correctionUrl": "https://github.com/calllint/calllint/issues/new?labels=trust-page-correction",
  "generatedAt": "2026-10-12T15:15:35.000Z",
  "signature": null
}
