{
  "schema": "calllint.evidence-manifest.v1",
  "subject": {
    "canonicalName": "mcp-registry/ai.agothe.mcp-chatgpt-agent-contract-preflight",
    "artifactDigest": "sha256:6eb84e2926d351404067fa558cacf535c9a4546bbd6aadf8b9afcb2c58019ab2"
  },
  "verdict": "REVIEW",
  "verdictLabel": "Review required",
  "completeness": "complete",
  "evidenceLevel": "E2",
  "evidenceRationale": "install config observed → static blast radius normalized into an authority inventory. Higher levels (E3 tool schema, E4 maintainer receipt, E5 sandbox) are not carried by a static page.",
  "status": {
    "verdict": "REVIEW",
    "completeness": "complete",
    "authorityClaimed": false,
    "reproducibility": {
      "pageDigest": "sha256:b98872767686d2962337de1007f283548efe9f8158be5c82ebfac85ead1a172a",
      "observedAt": "2026-10-19T13:04:27.000Z"
    },
    "evidenceLevel": "E2"
  },
  "authority": {
    "digest": "sha256:08ab2cae2fe668e006981d89e839b52bda3cf1c9662cf8a73947f119a7aa5f02",
    "completeness": "complete",
    "capabilityCount": 1,
    "approvalRequired": [
      "external-network-access"
    ],
    "capabilities": [
      {
        "action": "connect",
        "resource": "network",
        "mutability": "mutating",
        "reversibility": "irreversible",
        "approvalRequirement": "review"
      }
    ]
  },
  "policyDigest": null,
  "reproducibility": {
    "pageDigest": "sha256:b98872767686d2962337de1007f283548efe9f8158be5c82ebfac85ead1a172a",
    "observedAt": "2026-10-19T13:04:27.000Z"
  },
  "engine": {
    "name": "calllint"
  },
  "correctionUrl": "https://github.com/calllint/calllint/issues/new?labels=trust-page-correction",
  "generatedAt": "2026-10-19T13:04:27.000Z",
  "signature": null
}
