{
  "schema": "calllint.evidence-manifest.v1",
  "subject": {
    "canonicalName": "calllint-fixtures/block-filesystem",
    "artifactDigest": "sha256:5b96a3b96cae8824d66b71bf4f49af702b2ae25a4a82d27d59c08125310c09ee"
  },
  "verdict": "BLOCK",
  "verdictLabel": "Blocked by policy",
  "completeness": "complete",
  "evidenceLevel": "E2",
  "evidenceRationale": "install config observed → static blast radius normalized into an authority inventory. Higher levels (E3 tool schema, E4 maintainer receipt, E5 sandbox) are not carried by a static page.",
  "status": {
    "verdict": "BLOCK",
    "completeness": "complete",
    "authorityClaimed": false,
    "reproducibility": {
      "pageDigest": "sha256:9b2247c3ed838bcf6704bbc9bed8611b34f8242202a89a2d2548bf6b8c01b1f0",
      "observedAt": "1970-01-01T00:00:00.000Z"
    },
    "evidenceLevel": "E2"
  },
  "authority": {
    "digest": "sha256:8686add9ad012a49248deff42a0d3f3b4cf971452f582355603fe12058b88aa5",
    "completeness": "complete",
    "capabilityCount": 1,
    "approvalRequired": [],
    "capabilities": [
      {
        "action": "execute",
        "resource": "process",
        "mutability": "mutating",
        "reversibility": "irreversible",
        "approvalRequirement": "none"
      }
    ]
  },
  "policyDigest": null,
  "reproducibility": {
    "pageDigest": "sha256:9b2247c3ed838bcf6704bbc9bed8611b34f8242202a89a2d2548bf6b8c01b1f0",
    "observedAt": "1970-01-01T00:00:00.000Z"
  },
  "engine": {
    "name": "calllint"
  },
  "correctionUrl": "https://github.com/calllint/calllint/issues/new?labels=trust-page-correction",
  "generatedAt": "1970-01-01T00:00:00.000Z",
  "signature": null
}
